[
  {
    "generated": false,
    "id": "architecture",
    "kind": "narrative",
    "origin": "LEGACY-v1",
    "owner": "framework maintainers",
    "path": "docs/ARCHITECTURE.md",
    "status": "proposed",
    "verified_at": "2026-09-21",
    "verified_by": "Claude Fable 5.1",
    "verified_note": "TASK-PUBLISH-01 changed one condition in the testing mandate; §3 and §6 unaffected, read against 6f9ec7c",
    "verified_source_digest": "9605c4117860a528",
    "watches": [
      "scripts/aegis/aegis_cli/**",
      "hooks/**",
      "workflows/**"
    ]
  },
  {
    "generated": false,
    "id": "cli-reference",
    "kind": "api-reference",
    "origin": "LEGACY-v1",
    "owner": "framework maintainers",
    "path": "README.md",
    "status": "proposed",
    "verified_at": "2026-09-21",
    "verified_by": "Claude Fable 5.1",
    "verified_note": "verified against the code by three independent review rounds on 2026-09-19; every false sentence they named is corrected",
    "verified_source_digest": "b480d5e7b90f06fd",
    "watches": [
      "scripts/aegis/aegis_cli/__main__.py"
    ]
  },
  {
    "generated": false,
    "id": "evaluation",
    "kind": "record",
    "origin": "LEGACY-v1",
    "owner": "framework maintainers",
    "path": "docs/EVALUATION.md",
    "status": "proposed",
    "watches": [
      "docs/EVALUATION.md"
    ]
  },
  {
    "generated": false,
    "id": "usage",
    "kind": "usage-examples",
    "origin": "LEGACY-v1",
    "owner": "framework maintainers",
    "path": "README.md",
    "status": "proposed",
    "verified_at": "2026-09-21",
    "verified_by": "Claude Fable 5.1",
    "verified_note": "the loop and the commands it names were driven end to end by three review rounds on 2026-09-19",
    "verified_source_digest": "9ab0cd2cf5427ea6",
    "watches": [
      "skills/**",
      "agents/**",
      "workflows/**"
    ]
  }
]
